{
  "artifacts": {
    "catalog-v1.json": {
      "bytes": 196652,
      "sha256": "e75fee369bf6ad0e4f7d34109c13b7550106603b7129db067034f45b2a9955d3"
    },
    "provenance-v1.json": {
      "bytes": 7208,
      "sha256": "bfac534e726bccd28fe66248a824a6cc9de07b44b5b602a7ac3b288a38013a55"
    }
  },
  "generated_at": "2026-09-09T08:56:46Z",
  "minimum_euler_version": "0.1.1",
  "release_id": "catalog-v1-20260909t085646z-c40248a85eb54df737eb1400d7463b51bec7cb638abd971f0f8ab949b1dbeed9",
  "schema_version": 1
}
